{
  "schema_version": 1,
  "authority": "personal",
  "developer_mode_allowed": true,
  "recovery_mode_allowed": false,
  "store_install_allowed": true,
  "store_auto_update_allowed": true,
  "store_metrics_allowed": true,
  "app_launch_policy": "allow-all",
  "allowed_apps": [],
  "denied_permissions": []
}
